index,name,price,number_of_comment,brand,size(inch),display,type,weight(kg),comment
0,Smart Tivi Samsung 4K 50 inch UA50RU7100,9553000 ,280,Samsung,50,UHD 4K 3840 x 2160,Smart Tivi,13.9, Giao hàng nhanh  sản phẩm tốt trong tầm giá Tuy nhiên rất không hài lòng là cung cấp không kích hoạt bảo hành cho mình và không ai hướng dẫn kích hoạt BH  phải gọi lên tông đai nhờ hỗ trơ  đến nay vẫn chưa nhận được tin nhắn kích hoat BH thành công TIKI nên có chính sách hỗ trợ kích hoạt BH cho khách hàng sau khi giao hàng thành công khoảng 1 ngày Giao hàng nên giới thiệu luôn đơn vị lắp đặt trong trường hợp cần gắn vào tiên có trả phí chứa không đợi trong vòng 48 giờ nữa   Trong giao diện YOUTUBE khi mở ra thì hình không có màu nhưng chọn cụ thể vào thì vẫn có màu bình thường  bạn nào biết xin chỉ giúp giùm
0,Smart Tivi Samsung 4K 50 inch UA50RU7100,9553000 ,280,Samsung,50,UHD 4K 3840 x 2160,Smart Tivi,13.9,Mình đã nhận tivi sau 1 ngày đặt hàng Cảm ơn tiki giao hàng rất nhanh Hàng mới  hiện tại sử dụng tốt   Tuy nhiên về vấn đề bảo hành nhờ tiki hỗ trợ giùm Mình có nhắn tin 14 số serial đầu  thông tin ghi sau máy lại có tận 15 số đến số 6060 nhưng thấy báo ko gửi đc
0,Smart Tivi Samsung 4K 50 inch UA50RU7100,9553000 ,280,Samsung,50,UHD 4K 3840 x 2160,Smart Tivi,13.9,Giao hàng trễ hẹn 2 lần  ko thấy ai đến lắp đặt Tiki bán hàng kiểu này thua điện máy xanh xa lắc Mua thử 1 lần cho biết và sẽ cảnh báo cho mọi người đừng dạj mua hàng để chuốt lấy bực mình Chưa được xem tivi nên chưa biết chất lương thế nào  Xin lỗi Tiki vì tôi nói sự thật hơi đụng chạm
0,Smart Tivi Samsung 4K 50 inch UA50RU7100,9553000 ,280,Samsung,50,UHD 4K 3840 x 2160,Smart Tivi,13.9,Đặt tối hôm trước  hôm sau giao luôn lên tận căn hộ dù mình ở tỉnh Nhân viên giao hàng nhẹ nhàng  nhiệt tình TV chạy ổn  mình chỉ cần đăng ký tài khoản SS và cài app SmartThings là tự cài đặt TV rất dễ Hệ thống tự động kích hoạt bảo hành cho mình Hiện nhà mình rất hài lòng với dv của Tiki và SS Sau một thời gian nếu có vấn đề sử dụng mình sẽ đánh giá lại 
0,Smart Tivi Samsung 4K 50 inch UA50RU7100,9553000 ,280,Samsung,50,UHD 4K 3840 x 2160,Smart Tivi,13.9,mua sản phẩm trước tết  tới giờ chưa ai gọi lắp máy  hay hướng dẫn sử dụng  hay kích hoạt bảo hành  Món hàng chục triệu mua giao xong quăng hàng đó  vậy xài làm sao  Ai kích hoạt bảo hành tiki ơi Ai mở ra test cho khách  Khách hàng thân thiết mua nhiều đơn còn vậy  khách hàng mới thì sao
0,Smart Tivi Samsung 4K 50 inch UA50RU7100,9553000 ,280,Samsung,50,UHD 4K 3840 x 2160,Smart Tivi,13.9,Giao hàng khá nhanh  sản phẩm tốt trong tầm giá Tuy nhiên rất không hài lòng là cửa hàng không kích hoạt bảo hành cho mình  check series sản phẩm với 6060 thì hàng giao từ 41 mà hôm nay 131 vẫn chưa được kích hoạt Gửi email support Tiki phản hồi rất chậm mà vẫn ko xử lý được Mua tại Wholesale VN Ai quan tâm bảo hành thì nên cảnh giác khi mua TV trên Tiki
0,Smart Tivi Samsung 4K 50 inch UA50RU7100,9553000 ,280,Samsung,50,UHD 4K 3840 x 2160,Smart Tivi,13.9,Mình không rõ chính sách giao hàng của Tiki có gồm lắp đặt không Mình đã mua TV của Tiki vài lần rồi và mình nhớ là nhân viên giao hàng có bóc ra và lắp đặt giúp chân TV cũng như để kiểm tra sản phảm Lần này giao đến nguyên 1 thùng  bố mẹ mình nhận và bạn nhân viên có bảo là bác tự bóc ra   lắp đặt  nếu có vấn đề gì gọi về công ty Thật sự 2 ông bà già thì rất lúng túng với 1 kiện hàng to như vậy  sao mà biết kiểm tra với lắp đặt 
0,Smart Tivi Samsung 4K 50 inch UA50RU7100,9553000 ,280,Samsung,50,UHD 4K 3840 x 2160,Smart Tivi,13.9,Dịch vụ giao hàng quá tệ  hái độ giao hàng của người giao hàng ko thể chấp nhận được Nói khách hàng hủy đơn để khỏi phải giao  đang nói chuyện thì tắt máy  gọi lại ko nghe và phải gọi lại rất nhiều lần mới giao hàng Câu từ thiếu tôn trọng  nói trống không và bất cần Tiki giao ko lắp  bảo khách tự lắp  sau yêu cầu thì hẹn lắp sau  chưa thấy liên hệ
0,Smart Tivi Samsung 4K 50 inch UA50RU7100,9553000 ,280,Samsung,50,UHD 4K 3840 x 2160,Smart Tivi,13.9,Mình mua đợt 1111 nên mua được giá 7800k TV viền mỏng  cài đặt vs đồng bộ đơn giản  thao tác phản hồi nhanh hơn cả cái box 4k đang xài Cài app Fpt Play  Youtube  Galaxy Phim   nhiều app hỗ trợ tương đối tốt Tần số quét 100Hz nên cho trải nghiệm xem phim tương đối đã mắt Tổng quan là hài lòng so vs mức giá
0,Smart Tivi Samsung 4K 50 inch UA50RU7100,9553000 ,280,Samsung,50,UHD 4K 3840 x 2160,Smart Tivi,13.9,TV giá rẻ  chất lượng tốt nhưng dịch vụ chán chọn giao hàng 23hr mà đến chiều hôm sau mới giao giao không gọi trước nên m rất bị động bị tính 170k tiền phí lắp đặt mà có làm gì đâu Đến lúc nv lắp đặt gọi còn ko biết đã giao hay chưa  nói chung dịch vụ Tiki đợt này chán
0,Smart Tivi Samsung 4K 50 inch UA50RU7100,9553000 ,280,Samsung,50,UHD 4K 3840 x 2160,Smart Tivi,13.9, Giao hàng nhanh  sản phẩm tốt trong tầm giá Tuy nhiên rất không hài lòng là cung cấp không kích hoạt bảo hành cho mình và không ai hướng dẫn kích hoạt BH  phải gọi lên tông đai nhờ hỗ trơ  đến nay vẫn chưa nhận được tin nhắn kích hoat BH thành công TIKI nên có chính sách hỗ trợ kích hoạt BH cho khách hàng sau khi giao hàng thành công khoảng 1 ngày Giao hàng nên giới thiệu luôn đơn vị lắp đặt trong trường hợp cần gắn vào tiên có trả phí chứa không đợi trong vòng 48 giờ nữa   Trong giao diện YOUTUBE khi mở ra thì hình không có màu nhưng chọn cụ thể vào thì vẫn có màu bình thường  bạn nào biết xin chỉ giúp giùm
0,Smart Tivi Samsung 4K 50 inch UA50RU7100,9553000 ,280,Samsung,50,UHD 4K 3840 x 2160,Smart Tivi,13.9,Mình đã nhận tivi sau 1 ngày đặt hàng Cảm ơn tiki giao hàng rất nhanh Hàng mới  hiện tại sử dụng tốt   Tuy nhiên về vấn đề bảo hành nhờ tiki hỗ trợ giùm Mình có nhắn tin 14 số serial đầu  thông tin ghi sau máy lại có tận 15 số đến số 6060 nhưng thấy báo ko gửi đc
0,Smart Tivi Samsung 4K 50 inch UA50RU7100,9553000 ,280,Samsung,50,UHD 4K 3840 x 2160,Smart Tivi,13.9,Giao hàng trễ hẹn 2 lần  ko thấy ai đến lắp đặt Tiki bán hàng kiểu này thua điện máy xanh xa lắc Mua thử 1 lần cho biết và sẽ cảnh báo cho mọi người đừng dạj mua hàng để chuốt lấy bực mình Chưa được xem tivi nên chưa biết chất lương thế nào  Xin lỗi Tiki vì tôi nói sự thật hơi đụng chạm
0,Smart Tivi Samsung 4K 50 inch UA50RU7100,9553000 ,280,Samsung,50,UHD 4K 3840 x 2160,Smart Tivi,13.9,Đặt tối hôm trước  hôm sau giao luôn lên tận căn hộ dù mình ở tỉnh Nhân viên giao hàng nhẹ nhàng  nhiệt tình TV chạy ổn  mình chỉ cần đăng ký tài khoản SS và cài app SmartThings là tự cài đặt TV rất dễ Hệ thống tự động kích hoạt bảo hành cho mình Hiện nhà mình rất hài lòng với dv của Tiki và SS Sau một thời gian nếu có vấn đề sử dụng mình sẽ đánh giá lại 
0,Smart Tivi Samsung 4K 50 inch UA50RU7100,9553000 ,280,Samsung,50,UHD 4K 3840 x 2160,Smart Tivi,13.9,mua sản phẩm trước tết  tới giờ chưa ai gọi lắp máy  hay hướng dẫn sử dụng  hay kích hoạt bảo hành  Món hàng chục triệu mua giao xong quăng hàng đó  vậy xài làm sao  Ai kích hoạt bảo hành tiki ơi Ai mở ra test cho khách  Khách hàng thân thiết mua nhiều đơn còn vậy  khách hàng mới thì sao
0,Smart Tivi Samsung 4K 50 inch UA50RU7100,9553000 ,280,Samsung,50,UHD 4K 3840 x 2160,Smart Tivi,13.9,Giao hàng khá nhanh  sản phẩm tốt trong tầm giá Tuy nhiên rất không hài lòng là cửa hàng không kích hoạt bảo hành cho mình  check series sản phẩm với 6060 thì hàng giao từ 41 mà hôm nay 131 vẫn chưa được kích hoạt Gửi email support Tiki phản hồi rất chậm mà vẫn ko xử lý được Mua tại Wholesale VN Ai quan tâm bảo hành thì nên cảnh giác khi mua TV trên Tiki
0,Smart Tivi Samsung 4K 50 inch UA50RU7100,9553000 ,280,Samsung,50,UHD 4K 3840 x 2160,Smart Tivi,13.9,Mình không rõ chính sách giao hàng của Tiki có gồm lắp đặt không Mình đã mua TV của Tiki vài lần rồi và mình nhớ là nhân viên giao hàng có bóc ra và lắp đặt giúp chân TV cũng như để kiểm tra sản phảm Lần này giao đến nguyên 1 thùng  bố mẹ mình nhận và bạn nhân viên có bảo là bác tự bóc ra   lắp đặt  nếu có vấn đề gì gọi về công ty Thật sự 2 ông bà già thì rất lúng túng với 1 kiện hàng to như vậy  sao mà biết kiểm tra với lắp đặt 
0,Smart Tivi Samsung 4K 50 inch UA50RU7100,9553000 ,280,Samsung,50,UHD 4K 3840 x 2160,Smart Tivi,13.9,Dịch vụ giao hàng quá tệ  hái độ giao hàng của người giao hàng ko thể chấp nhận được Nói khách hàng hủy đơn để khỏi phải giao  đang nói chuyện thì tắt máy  gọi lại ko nghe và phải gọi lại rất nhiều lần mới giao hàng Câu từ thiếu tôn trọng  nói trống không và bất cần Tiki giao ko lắp  bảo khách tự lắp  sau yêu cầu thì hẹn lắp sau  chưa thấy liên hệ
0,Smart Tivi Samsung 4K 50 inch UA50RU7100,9553000 ,280,Samsung,50,UHD 4K 3840 x 2160,Smart Tivi,13.9,Mình mua đợt 1111 nên mua được giá 7800k TV viền mỏng  cài đặt vs đồng bộ đơn giản  thao tác phản hồi nhanh hơn cả cái box 4k đang xài Cài app Fpt Play  Youtube  Galaxy Phim   nhiều app hỗ trợ tương đối tốt Tần số quét 100Hz nên cho trải nghiệm xem phim tương đối đã mắt Tổng quan là hài lòng so vs mức giá
0,Smart Tivi Samsung 4K 50 inch UA50RU7100,9553000 ,280,Samsung,50,UHD 4K 3840 x 2160,Smart Tivi,13.9,TV giá rẻ  chất lượng tốt nhưng dịch vụ chán chọn giao hàng 23hr mà đến chiều hôm sau mới giao giao không gọi trước nên m rất bị động bị tính 170k tiền phí lắp đặt mà có làm gì đâu Đến lúc nv lắp đặt gọi còn ko biết đã giao hay chưa  nói chung dịch vụ Tiki đợt này chán
0,Smart Tivi Samsung 4K 50 inch UA50RU7100,9553000 ,280,Samsung,50,UHD 4K 3840 x 2160,Smart Tivi,13.9,Xài rất ưng ý  màu rất đẹp Tuy nhiên kết nối trực tiếp từ smart phone vào youtube của tv thì ko nhanh như những đời cũ hơn vd 2 thiết bị cùng kết nối thì thiết bị sau sẽ đá thiết bị đầu  tuy nhiên trên tv này chỉ cho phép 1 thiết bị kết nối  và khi thiết bị ban đầu dis thì thiết bị sau mới kết nối youtube được Bảo mật cao hơn nhưng mình thấy k tiện bằng vì mình xem youtube nhiều Bonus là mua tk Neflix coi 4k tuyệt vời ông mặt trời vì siêu nét Apple tv trade trực tiếp từ Apple device qua thì bị trễ tuỳ vào tốc độ mạng Chơi game live thì xác cmn định là lag nhé Hehe
0,Smart Tivi Samsung 4K 50 inch UA50RU7100,9553000 ,280,Samsung,50,UHD 4K 3840 x 2160,Smart Tivi,13.9,Tivi sắc nét  hình ảnh rất đẹp  kết nối internet nhanh chóng và dễ dàng Loa hơi nhỏ chút Mức giá này quá hài lòng với sản phẩm  Kích hoạt bảo hành chỉ cần nhắn tin số seri 6060 Tuy nhiên bình thường mình mua điện máy ở siêu thị điện máy thì sẽ được tự động kích hoạt bảo hành luôn  đây dùng 1 tuần không thấy bên nhà bán liên hệ hay có tin nhắn kích hoạt bảo hành nên phải tự mò
0,Smart Tivi Samsung 4K 50 inch UA50RU7100,9553000 ,280,Samsung,50,UHD 4K 3840 x 2160,Smart Tivi,13.9,Về Giao hàng Đăng kí tikinow giao trong 24 tiếng  nhưng phải 3 hôm sau mới nhận đc hàng Vấn đề không phải giao trễ có ít ngày mà là lời cam kết của tiki với khách hàng và khách hàng đã trả chi phí thì mong muốn nhận được dịch vụ tương xứng Về Sản phẩm có chất lượng hình ảnh hiện thị tốt  màu sắc đẹp Xem Netflix rất mượt Mới dùng được đôi ba hôm nên cũng chưa có đánh giá nhiều Mình tự lắp máy  cũng rất đơn giản  Về đăng ký bảo hành Chỉ cần nhắn dãy Số thứ tự trên tem máy được dán bên cạnh vỏ hộp đến tổng đài 6060 của Samsung  mới đầu sẽ có tin số seri  chưa đc đăng kí bh  quý khách vui lòng liên hệ cửa hàng bán máy  Để yên đó  sau 34 hôm sẽ có tin nhắn bảo hành điện tử Samsung gửi về Không cần nhờ ai đăng ký bảo hành hộ nhé
0,Smart Tivi Samsung 4K 50 inch UA50RU7100,9553000 ,280,Samsung,50,UHD 4K 3840 x 2160,Smart Tivi,13.9,Mình nhận hàng từ 141 nhưng dịch vụ cài đặt thì sau 1 ngày theo Tiki thông báo Ngày hôm sau thì bạn kĩ thuật báo là nhiều hàng nhờ mình tự cài đặt Khi mình mở TV ra thì rất nhiều bụi bám trên thân tivi  tiếc là mình ko chụp ảnh nên mình ko phàn nàn gì Bực mình ở chỗ mình thông báo cho bạn kĩ thuật để kích hoạt bảo hành cho mình nhưng đến giờ là 12 mình kiểm tra qua 6060 thì vẫn chưa được kích hoạt BH
0,Smart Tivi Samsung 4K 50 inch UA50RU7100,9553000 ,280,Samsung,50,UHD 4K 3840 x 2160,Smart Tivi,13.9,TIKI bán tivi có kèm gói lắp đặt nhưng chỉ thấy shiper trả hàng và vứt đấy cho mình không thấy bất kì cuộc gọi hỗ trợ nào từ nhà bán hàng 1 trải nghiệm vô cùng tồi tệ  và cũng không rõ sản phẩm của mình có được bảo hành không nữa
0,Smart Tivi Samsung 4K 50 inch UA50RU7100,9553000 ,280,Samsung,50,UHD 4K 3840 x 2160,Smart Tivi,13.9,Hẹn thứ Tư giao  đến thứ Tư gửi sms hẹn thứ Năm  Thứ Năm gửi email hẹn thứ Sáu  thứ Sáu liên hệ với hỗ trợ thì bảo thứ Bảy  thứ Bảy gần 5h chiều chưa thấy động tĩnh gọi cho CSKH phàn nàn thì 7h tối mới giao  Thực sự rất thất vọng
0,Smart Tivi Samsung 4K 50 inch UA50RU7100,9553000 ,280,Samsung,50,UHD 4K 3840 x 2160,Smart Tivi,13.9,tivi mới sx tháng 112019 hình ảnh đẹp  âm thanh lớn cài đặt trong â thanh chuyên môn nhận tivi và sử dụng ổn được 12 ngày đã 3 lần goi 19006035 nhưng vẫn chưa kích hoạt bảo hành Đề nghị tiki can thiệp kích hoạt dùmNếu  kích hoạt xong sẽ đánh giá cho 5
0,Smart Tivi Samsung 4K 50 inch UA50RU7100,9553000 ,280,Samsung,50,UHD 4K 3840 x 2160,Smart Tivi,13.9,Mình mua về cho ba mẹ ở quê  shipper rất nhiệt tình  hàng giao rất nhanh  bộ mẹ khen tivi đẹp xem rõ  tuy nhiên bố mẹ lớn tuổi k biết kiích hoạt bảo hành điện tử  nhờ tiki kik hoạt bảo hành giùm mình
0,Smart Tivi Samsung 4K 50 inch UA50RU7100,9553000 ,280,Samsung,50,UHD 4K 3840 x 2160,Smart Tivi,13.9,Mình mới dùng đc 2 ngày cũng chưa nói đc gì nhưng xem khá nét  khá ok Nv giao hàng nhiệt tình Mà nv bảo bảo hành luôn trên hệ thống nhưng mình kb xem ở đâu nhoè tiki giúp á
0,Smart Tivi Samsung 4K 50 inch UA50RU7100,9553000 ,280,Samsung,50,UHD 4K 3840 x 2160,Smart Tivi,13.9,Giao hàng đúng ngày  hàng nguyên seal chưa khui Chỉ là giao xong ko có người hỗ trợ lắp đặt liền Giao xonh để cái thùng tv ngồi ngó chả biết làm gì với nó 
0,Smart Tivi Samsung 4K 50 inch UA50RU7100,9553000 ,280,Samsung,50,UHD 4K 3840 x 2160,Smart Tivi,13.9,Hình ảnh rõ  đẹp  vào mạng nhanh  chỉ không vừa lòng chỗ tivi mới mở ra đã có sẵn các kênh của truyền hình cáp
0,Smart Tivi Samsung 4K 50 inch UA50RU7100,9553000 ,280,Samsung,50,UHD 4K 3840 x 2160,Smart Tivi,13.9,TV ổn tốt ko có vấn đề gì Có nhân viên liên lạc để kích hoạt bảo hành Nhà mình tự lắp luôn nên ko cần hỗ trợ lắp đặt Giá lại đc sale nên ổn nha moing ơi
0,Smart Tivi Samsung 4K 50 inch UA50RU7100,9553000 ,280,Samsung,50,UHD 4K 3840 x 2160,Smart Tivi,13.9,Gắn cáp vào cổng optical để chuyển âm thanh sang ampli thì không sát  bị hở sụt sịch Nếu sử dụng Youtube mở clip nào mà không có hỗ trợ định dạng 4k là bị rè rè không nghe được
0,Smart Tivi Samsung 4K 50 inch UA50RU7100,9553000 ,280,Samsung,50,UHD 4K 3840 x 2160,Smart Tivi,13.9,Sản phẩm chính hãng  giao hàng nhanh và được kích hoạt bảo hành điện tử vào số điện thoại Rất tốt Đánh giá 5 sao Mình mua từ nhà cung cấp Điện máy city
0,Smart Tivi Samsung 4K 50 inch UA50RU7100,9553000 ,280,Samsung,50,UHD 4K 3840 x 2160,Smart Tivi,13.9,Tivi xem nét mịn  màu sắc tươi sáng  âm thanh rõ nét truyền hình hỗ trợ các kênh CNN  BBC Ứng dụng vào nhanh Với giá 9 7triệu cho TV50 inch là rất hợp lý Rất hài lòng
0,Smart Tivi Samsung 4K 50 inch UA50RU7100,9553000 ,280,Samsung,50,UHD 4K 3840 x 2160,Smart Tivi,13.9,xem vừa mắt với khoảng cách tầm 3m đang chờ kích hoạt bảo hành
0,Smart Tivi Samsung 4K 50 inch UA50RU7100,9553000 ,280,Samsung,50,UHD 4K 3840 x 2160,Smart Tivi,13.9,tạm thời thì rất ok nhừng về lâu thì chưa biết  3 ngày rui mà chứa thấy sámung kích hoạt bảo hành cho mình
0,Smart Tivi Samsung 4K 50 inch UA50RU7100,9553000 ,280,Samsung,50,UHD 4K 3840 x 2160,Smart Tivi,13.9,Giao hàng lắp đặt nhanh chóng dù ko phải là tikinow Sáng đặt chiều giao luôn rồi Tivi tốt Hình ảnh rõ nét âm thanh sống động Giá
0,Smart Tivi Samsung 4K 50 inch UA50RU7100,9553000 ,280,Samsung,50,UHD 4K 3840 x 2160,Smart Tivi,13.9,Tv xem tốt  mua được giá tốt Mua hôm t7 thì thứ 2 nhân viên đến lắp đặt Mình cho thêm nv lắp đặt 100k
0,Smart Tivi Samsung 4K 50 inch UA50RU7100,9553000 ,280,Samsung,50,UHD 4K 3840 x 2160,Smart Tivi,13.9,Giao hàng đúng ngày dự kiến Nhưng sản phẩm vẫn chưa kích hoạt bảo hành không biết làm thế nào để kích hoạt Mong nhận được support từ tiki
0,Smart Tivi Samsung 4K 50 inch UA50RU7100,9553000 ,280,Samsung,50,UHD 4K 3840 x 2160,Smart Tivi,13.9,Giáo hàng nhanh hơn dự kiến  dùng được 1 tháng rồi OK Nhưng không thấy thông báo kích hoạt thời gian bảo hành Muốn ĐK bảo hành làm thế nào shops
0,Smart Tivi Samsung 4K 50 inch UA50RU7100,9553000 ,280,Samsung,50,UHD 4K 3840 x 2160,Smart Tivi,13.9,Hài lòng về sản phẩm Không biết sử dụng lâu dài như nào mà trước mắt cho 4 sao vì vẫn chưa kích hoạt bảo hành được
0,Smart Tivi Samsung 4K 50 inch UA50RU7100,9553000 ,280,Samsung,50,UHD 4K 3840 x 2160,Smart Tivi,13.9,Chất lượng tốt  mua thêm 1 bàn phím không dây  chuột không dây  cho các bạn nhỏ học online mùa covid19 đúng chuẩn
0,Smart Tivi Samsung 4K 50 inch UA50RU7100,9553000 ,280,Samsung,50,UHD 4K 3840 x 2160,Smart Tivi,13.9,Mua được hơn 1 tuần mà vẫn chưa kích hoạt được chế độ bảo hành  đề nghị tiki can thiệp kích hoạt bảo hành
0,Smart Tivi Samsung 4K 50 inch UA50RU7100,9553000 ,280,Samsung,50,UHD 4K 3840 x 2160,Smart Tivi,13.9,rất tuyệt  giá rẻ hình ảnh rất nét cách đây 8 năm tôi có mua 1 cái tv samsung 37 inch  sử dụng đến bây giờ vẫn còn tốt
0,Smart Tivi Samsung 4K 50 inch UA50RU7100,9553000 ,280,Samsung,50,UHD 4K 3840 x 2160,Smart Tivi,13.9,Chưa mở pack nên chưa check được sản phẩm nhưng cho 5sao khâu giao hàng rất nhanh Đặt hôm trước hôm sau đã giao đến tận Đà Lạt 
0,Smart Tivi Samsung 4K 50 inch UA50RU7100,9553000 ,280,Samsung,50,UHD 4K 3840 x 2160,Smart Tivi,13.9,Đã dùng được 1 tuần   giao hàng nhanh chóng   tivi đẹp   sắc nét nhưng không hiểu sao tiki vẫn chưa kích hoạt bảo hành điện tử
0,Smart Tivi Samsung 4K 50 inch UA50RU7100,9553000 ,280,Samsung,50,UHD 4K 3840 x 2160,Smart Tivi,13.9,màu đẹp tự động kết nối fpt play với galaxy free 12 tháng
0,Smart Tivi Samsung 4K 50 inch UA50RU7100,9553000 ,280,Samsung,50,UHD 4K 3840 x 2160,Smart Tivi,13.9,Tiki giao hàng rất nhanh Sản phẩm tốt Đúng như miêu tả
0,Smart Tivi Samsung 4K 50 inch UA50RU7100,9553000 ,280,Samsung,50,UHD 4K 3840 x 2160,Smart Tivi,13.9,Sản phẩm mới  đẹp  giao hàng nhanh Đặt hàng sáng thứ Tư mà sáng thứ 6 đã giao đến Cai Lậy  Tiền Giang
0,Smart Tivi Samsung 4K 50 inch UA50RU7100,9553000 ,280,Samsung,50,UHD 4K 3840 x 2160,Smart Tivi,13.9,giao nhanh  nhân viên giao hàng lịch sự vui vẻ  rất hài lòng về sản phẩm này khi mua tại tiki
0,Smart Tivi Samsung 4K 50 inch UA50RU7100,9553000 ,280,Samsung,50,UHD 4K 3840 x 2160,Smart Tivi,13.9,Sản phẩm chất lượng tốt  giá sale quá ổn so với sản phẩm cùng loại trên thị trường Thank Tiki
0,Smart Tivi Samsung 4K 50 inch UA50RU7100,9553000 ,280,Samsung,50,UHD 4K 3840 x 2160,Smart Tivi,13.9,Dịch vụ kém làm việc ko rõ ràng giao hàng điện tử mà ko kiểm tra sp cho khách  ko cài đặt test sp
0,Smart Tivi Samsung 4K 50 inch UA50RU7100,9553000 ,280,Samsung,50,UHD 4K 3840 x 2160,Smart Tivi,13.9,Thái độ lắp đặt ảnh hưởng chất lượng dịch vụ  Cần quy định kỹ hơn cho đối tác lắp đặt
0,Smart Tivi Samsung 4K 50 inch UA50RU7100,9553000 ,280,Samsung,50,UHD 4K 3840 x 2160,Smart Tivi,13.9,Sản phẩm chất lượng đẹp  giao hàng nhanh  có điều bên lắp đặt liên hệ sau đó hơn 1 tuần mình tự lắp luôn
0,Smart Tivi Samsung 4K 50 inch UA50RU7100,9553000 ,280,Samsung,50,UHD 4K 3840 x 2160,Smart Tivi,13.9,Đóng gói cẩn thận  vận chuyển nhanh nhưng không có nhân viên hỗ trợ lắp đặt và test thử sản phẩm
0,Smart Tivi Samsung 4K 50 inch UA50RU7100,9553000 ,280,Samsung,50,UHD 4K 3840 x 2160,Smart Tivi,13.9,Tiki giao hàng cực nhanh  đặt hàng hôm trước Hôm sau nhận hàng luôn Giá rẻ hơn siêu thị tận 2tr
0,Smart Tivi Samsung 4K 50 inch UA50RU7100,9553000 ,280,Samsung,50,UHD 4K 3840 x 2160,Smart Tivi,13.9,Góc nhìn màn hình kém  nhìn nghiêng là ảnh xấu hẳn Phần mềm nhanh mạnh và tiện lợi
0,Smart Tivi Samsung 4K 50 inch UA50RU7100,9553000 ,280,Samsung,50,UHD 4K 3840 x 2160,Smart Tivi,13.9,Đã nhận hàng đầy đủ  giao nhanh  hàng chuẩn  xem tốt lắm  nhưng chưa biết kích hoạt bảo hành như thế nào
0,Smart Tivi Samsung 4K 50 inch UA50RU7100,9553000 ,280,Samsung,50,UHD 4K 3840 x 2160,Smart Tivi,13.9,Nhờ shop kích hoạt bảo hình giúp Nếu không  Xin chỉ cánh kích hoạt bảo hành Cám ơn nhiều
0,Smart Tivi Samsung 4K 50 inch UA50RU7100,9553000 ,280,Samsung,50,UHD 4K 3840 x 2160,Smart Tivi,13.9,Nv giao hàng Best không hỗ trợ lắp đặt dù có khoản lắp đặt trong đơn hàng Tivi tốt
0,Smart Tivi Samsung 4K 50 inch UA50RU7100,9553000 ,280,Samsung,50,UHD 4K 3840 x 2160,Smart Tivi,13.9,hi shop mình mua tivi từ 922020 đến giờ check vẫn chưa thấy active bảo hành
0,Smart Tivi Samsung 4K 50 inch UA50RU7100,9553000 ,280,Samsung,50,UHD 4K 3840 x 2160,Smart Tivi,13.9,tivi đẹp nv giao hàng nhiệt tình cho 5
0,Smart Tivi Samsung 4K 50 inch UA50RU7100,9553000 ,280,Samsung,50,UHD 4K 3840 x 2160,Smart Tivi,13.9,Sản phẩm đúng như mô tả  hàng mới  Đề nghị bên bán kích hoạt bảo hành cho khách hàng
0,Smart Tivi Samsung 4K 50 inch UA50RU7100,9553000 ,280,Samsung,50,UHD 4K 3840 x 2160,Smart Tivi,13.9,giao hàng sớm dự kiến  sau 4 hôm thì có tin nhắn kích hoạt bảo hành  rất hài lòng
0,Smart Tivi Samsung 4K 50 inch UA50RU7100,9553000 ,280,Samsung,50,UHD 4K 3840 x 2160,Smart Tivi,13.9,Mua hàng của điện máy city  sản phẩm chính hãng  kích hoạt bảo hành ngay khi nhận sản phẩm
0,Smart Tivi Samsung 4K 50 inch UA50RU7100,9553000 ,280,Samsung,50,UHD 4K 3840 x 2160,Smart Tivi,13.9,khá hài lòng với chất lượng Tuy nhiên cần đào tạo chuyên môn kỹ thuật cho nhân viên giao hàng
0,Smart Tivi Samsung 4K 50 inch UA50RU7100,9553000 ,280,Samsung,50,UHD 4K 3840 x 2160,Smart Tivi,13.9,điều khiển tù quá   chip xử lý yếu nên dễ lag  chất lượng hiển thị ngon trong tầm
0,Smart Tivi Samsung 4K 50 inch UA50RU7100,9553000 ,280,Samsung,50,UHD 4K 3840 x 2160,Smart Tivi,13.9,Giao hàng nhanh chỉ trong 24h mỗi tội thiếu mất mấy con vít
0,Smart Tivi Samsung 4K 50 inch UA50RU7100,9553000 ,280,Samsung,50,UHD 4K 3840 x 2160,Smart Tivi,13.9,giao hàng rất nhanh  tầm 2h là có but p đợi thứ 2 kỹ thuật đến lắp mới biết đc
