index,name,price,number_of_comment,brand,size(inch),display,type,weight(kg),comment
55,Smart Tivi LG 4K 55 inch 55UM7300PTA,10990000 ,203,LG,55,UHD 4K 3840 x 2160,Smart TV,14.3,Giao hàng đóng gói kĩ  hàng nguyên seal chưa qua sử dụng  nhân viên giao hàng nhiệt tình  còn giúp mình lắp chân tivi  rất dễ thương Tivi hình ảnh đẹp  do coi quen samsung nên thấy hơi nhợt nhạt nhưng k sao  màu sắc trung thực Có điều tần số quét 50hz nên đôi lúc cảm thấy k mượt mà  nhưng tổng quan chung là tốt Loa tv tốt  tai trâu nên nghe vậy thực sự thấy ổn Magic remote là quá khác biệt so với các hãng còn lại  riêng phần này cho 10đ Tìm kiếm bằng giọng nói k bằng đc google assistant 1 từ thôi  hài lòng về những gì tiki đem lại  vấn đề cuối cùng là độ bền của tivi thôi  cảm ơn tiki
55,Smart Tivi LG 4K 55 inch 55UM7300PTA,10990000 ,203,LG,55,UHD 4K 3840 x 2160,Smart TV,14.3,Đã mua và rất hài lòng với TV LG Mình mua của Tiki Trading trước tết giá 10tr8  so với con Samsung cũng 55 inch của bố vợ giá 10tr4 thì màu sắc nhìn đẹp hơn hẳn  lại có Magic remote dùng cũng tiện hơn Youtube thì không có sẵn mà phải vào LG Store cài Bạn nào lắp treo tường mà có khoan thì nên mua giá treo về tự lắp  mua giá nghiêng được thì tiện hơn  dễ chỉnh góc Mình ban đầu lắp hơi cao  sau phải hạ xuống 20 cm Trước khi lắp mọi người nên ướm trước  cho tầm mắt nhìn thẳng vào chính giữa tivi là đẹp nhất
55,Smart Tivi LG 4K 55 inch 55UM7300PTA,10990000 ,203,LG,55,UHD 4K 3840 x 2160,Smart TV,14.3,good job   ban đầu cũng lo lắng bên vận chuyển sợ hư hỏng  đến hôm nay nhận được quá ok   bên giao hàng nhiệt tình rinh tivi vào tận nhà cho kiểm tra bên trong luôn   mở ra tivi to hơn dự tính của mình   quá là ô kê luôn nha   mọi người nên mua 
55,Smart Tivi LG 4K 55 inch 55UM7300PTA,10990000 ,203,LG,55,UHD 4K 3840 x 2160,Smart TV,14.3,Mình mua của Tiki Trading sau khi tham khảo giá 1 vòng các nhà cung cấp khác Hàng giao chậm hơn dự kiến 1 ngày Bên giao hàng cho kiểm tra ngoại quan nhưng không hỗ trợ  lắp đặt gì Sau khi thanh toán  mình phải tự gắn lên chân đế Sau đó bên kỹ thuật Tiki gọi đến hỏi tivi anh lắp chưa Mình nói lắp lên chân đế thôi  thế là bên kia nói vậy được rồi và ko hỗ trợ gì thêm Nói chung thì mua trên Tiki được cái giá tốt nhất  nhưng phải biết chút ít để tự làm nhé Sản phẩm LG thì chất lượng tốt rồi  khỏi phải lo
55,Smart Tivi LG 4K 55 inch 55UM7300PTA,10990000 ,203,LG,55,UHD 4K 3840 x 2160,Smart TV,14.3,Ưu điểm Tivi to  giá hợp lý  màu đẹp  web os đủ dùng  điều khiển thông minh  tiện dụng Nhược điểm khá dày và nặng  treo lên tường sẽ lồi ra khá nhiều Nhân viên lắp giá treo 350k  khá đắt so với thị trường Vận chuyển rất lâu  8 ngày mới giao hàng
55,Smart Tivi LG 4K 55 inch 55UM7300PTA,10990000 ,203,LG,55,UHD 4K 3840 x 2160,Smart TV,14.3,Tiki giao hàng trước dự kiến 1 ngày  kỹ thuật hẹn qua treo tường ngay hôm sau  Hàng được kiểm tra tổng quan  tiki đóng gói ốp thêm 2 tấm xốp bảo vệ  thùng hàng nguyên vẹn kiểm tra tổng quan đảm bảo sau lắp đặt treo tường chạy tốt Cảm ơn Tiki và đối tác đã mang sản phẩm chất lượng và giá mềm đến khách hàng Mình sẽ ủng hộ và giới thiệu cho ai có nhu cầu mua sắm 
55,Smart Tivi LG 4K 55 inch 55UM7300PTA,10990000 ,203,LG,55,UHD 4K 3840 x 2160,Smart TV,14.3,Mua TV giá rẻ của thương hiệu LG thì nên kiểm tra kĩ khi nhận hàng  đặc biệt là lỗi hở sáng màn hình Nếu không có lỗi gì ngay từ đầu thì TV LG xài bền và ổn trong tầm giá Kiểm tra kĩ khi nhận hàng để tránh việc đổi trả rất mất thời gian và mệt mỏi Mặc dù Tiki làm rất tốt dịch vụ chăm sóc khách hàng nhưng việc phải trả món hàng mới mua  chờ đợi đổi là 1 trải nghiệm không vui vẻ gì
55,Smart Tivi LG 4K 55 inch 55UM7300PTA,10990000 ,203,LG,55,UHD 4K 3840 x 2160,Smart TV,14.3,Gần đây mua hàng TiKi toàn ko hài lòng  lịch lắp đặt 48h mà giờ ngày thứ 3 chưa ai liên hệ hẹn lắp  những gian hàng khác đang cố gắng lắp ngay cho khách   đã gọi hotline thì đổ tháo trách nhiệm cho đối tác lắp đặt  khách hàng lâu năm của tiki rồi nhưng chắc ko còn là vậy nữa  TV hư mới cần mua mà chờ đc dùng thì tụt hết hứng  Mình ở trung tâm TPHCM còn vậy ở vùng ven chắc ôm cái thùng cả tuần mới đc xài 
55,Smart Tivi LG 4K 55 inch 55UM7300PTA,10990000 ,203,LG,55,UHD 4K 3840 x 2160,Smart TV,14.3,đã nhận vào thứ sáu 225 giá 10tr440 mà hôm nay giảm đi 70k rồi  TV dùng kết hợp với đầu thu Viettel để xem  phải nói là quá đã  hình ảnh sắc nét dù đầu thu chỉ phát HD Muốn nghe âm thanh hay hơn khi xem phim hành động thì kết nối thêm dàn Blueray 51 Sony 950wcó sẵn từ lâu rồi dù âm thanh của TV cũng khá hay
55,Smart Tivi LG 4K 55 inch 55UM7300PTA,10990000 ,203,LG,55,UHD 4K 3840 x 2160,Smart TV,14.3,Giao tv đã bị đóng lại seal 3 lần  tv đóng bụi  1 chân tv bị gãy và dính vào bên trong  gọi điện tìm hướng giải quyết nhưng 1 tuần không thấy hồi đáp  quá tệ về dịch vụ
55,Smart Tivi LG 4K 55 inch 55UM7300PTA,10990000 ,203,LG,55,UHD 4K 3840 x 2160,Smart TV,14.3,Mình đã chọn đúng Tiki trading để mua  hàng chính hãng  giá tốt 10950k Tổng đài CSKH 19006035  để theo dõi đơn và tư vấn cũng rất nhanh và hiệu quả Sau khi giao hàng có nhân viên gọi điện đến hẹn gặp hỗ trợ  nhưng mình đã tự giải quyết được cả rồi Sau đó thì có tin nhắn LG báo đã kích hoạt bảo hành Hài lòng  chưa có gì trục trặc LG 55UM7300PTA thật sự thông minh và dễ sử dụng  hi vọng sẽ bền bỉ như hai cái 43 inch cũng LG mình đã mua trước đây
55,Smart Tivi LG 4K 55 inch 55UM7300PTA,10990000 ,203,LG,55,UHD 4K 3840 x 2160,Smart TV,14.3,Khâ hài lòng với sản phẩm và tính năng Sản phẩm đi kèm điều khiển mới có thể dùng được chức năng điều khiển bằng giọng nói và cũng có thể đung như chuột máy tính Âm thanh tốt Tiki tự động kích hoạt bào hành2 năm Tuy được hứa là hỗ trợ lắp đặt trong 48h nhưng không thấy nhân viên hay ai liên hệ lại về việc này
55,Smart Tivi LG 4K 55 inch 55UM7300PTA,10990000 ,203,LG,55,UHD 4K 3840 x 2160,Smart TV,14.3,Nhận tivi tuy nhiên thiếu ốc  1 chân đế bị gãy khớp  thiếu 1 điều khiển thường so với tờ hướng dẫn Sau khi liên hệ tiki mặc dù phải mất 34 lần làm việc với tiki và lg thì mới nhận đc đầy đủ nhưng cách làm vc của tiki khiến mình khá hài lòng
55,Smart Tivi LG 4K 55 inch 55UM7300PTA,10990000 ,203,LG,55,UHD 4K 3840 x 2160,Smart TV,14.3,Hàng họ OK  mỗi tội khó chịu với thái độ của nhân viên giao hàng Mình ở chung cư tầng 19 mà bắt xuống tầng 1 nhận hàng Đến khi mình bảo ko hỗ trợ giao lên trên nhà thì trả lại hàng thì mới thay đổi thái độ và chuyển lên trên nhà cho mình
55,Smart Tivi LG 4K 55 inch 55UM7300PTA,10990000 ,203,LG,55,UHD 4K 3840 x 2160,Smart TV,14.3,Nhân viên giao hàng chuyên nghiệp  đúng hẹn Tivi rất tốt trong tầm giá này có rất nhiều điểm kỹ thuật cao hơn các model tv khác trong tầm giá như bộ xử lý codec âm thanh nổi trội hơn các dòng tv Samsung Điểm 1010
55,Smart Tivi LG 4K 55 inch 55UM7300PTA,10990000 ,203,LG,55,UHD 4K 3840 x 2160,Smart TV,14.3,Tivi bị lỗi giải quyết quá chậm không cho khách hàng biết hướng giải quyết như thế nào phải chờ trong vô vọnglần nào gọi lên Tiki cũng không có người bắt máyMua hàng online kiểu này lần sau sao dám mua
55,Smart Tivi LG 4K 55 inch 55UM7300PTA,10990000 ,203,LG,55,UHD 4K 3840 x 2160,Smart TV,14.3,Tivi to  hình ảnh đẹp  mới nguyên  sản xuất 2020  âm thanh vòm sống động Kết hợp thêm quả voucher 999k của tiki quá là tuyệt vời luôn Cảm ơn tiki và LG rất nhiều
55,Smart Tivi LG 4K 55 inch 55UM7300PTA,10990000 ,203,LG,55,UHD 4K 3840 x 2160,Smart TV,14.3,Hàng giao sớm 1 ngày Hài lòng Nhưng vì mua 55in nhỏ so với phòng kháchkhông biết tiki có cho đổi sang cái to hơn k nhilỡ mua bên tiki k đổi được thì phảiông xã càm ràm vì nếu mua chỗ khác đã được đổi mua tivi bự hơn
55,Smart Tivi LG 4K 55 inch 55UM7300PTA,10990000 ,203,LG,55,UHD 4K 3840 x 2160,Smart TV,14.3,Ti vi LG Chính hãnggiao hàng quá nhanhtối đặt hàng mà sáng hôm sau đã giaomình chưa thấy ở đâu giao nhanh như vậyNói chung sản phẩm ok trong tầm giá
55,Smart Tivi LG 4K 55 inch 55UM7300PTA,10990000 ,203,LG,55,UHD 4K 3840 x 2160,Smart TV,14.3,Giao hàng nhanh  tivi xem sướng  bắt sóng tốt  và điều khiển magic rất tốt Nói chung hài lòng về sản phẩm và giá cả cho chiếc GL 554K
55,Smart Tivi LG 4K 55 inch 55UM7300PTA,10990000 ,203,LG,55,UHD 4K 3840 x 2160,Smart TV,14.3,Mua sản phẩm của điện máy city  mới đầu băn khoăn không biết chất lượng ra sao Nhưng giờ yên tâm tuyệt đối sau một thời gian dài sử dụng Đợt trước có mua của tiki trading được 5 ngày thì tạch
55,Smart Tivi LG 4K 55 inch 55UM7300PTA,10990000 ,203,LG,55,UHD 4K 3840 x 2160,Smart TV,14.3,tivi chất lượng tốt  không lỗi gì  lúc đầu bạn giao hàng kêu mình test tại hầm chung cư luôn  ko mang lên  thôi kệ bỏ qua  đổi lại thì TV sử dụng ổn  chưa thấy lỗi lầm gì
55,Smart Tivi LG 4K 55 inch 55UM7300PTA,10990000 ,203,LG,55,UHD 4K 3840 x 2160,Smart TV,14.3,Sản phẩm giao nhanh  tính năng tốt  có magic remote dễ sử dụng  Kích cỡ  tính năng và hiệu suất tốt so với giá  Điểm cần cải thiện tốc độ gọichuyển menu hơi chậm
55,Smart Tivi LG 4K 55 inch 55UM7300PTA,10990000 ,203,LG,55,UHD 4K 3840 x 2160,Smart TV,14.3,Tiki giao hàng nhanh chóng  nhân viên giao hàng mr Dũng nhiệt tình  chuyên nghiệp  Sản phẩm dùng tốt cảm nhận ban đầu  Hài lòng  Đề nghị Điện máy City kích hoạt bảo hành cho sản phẩm
55,Smart Tivi LG 4K 55 inch 55UM7300PTA,10990000 ,203,LG,55,UHD 4K 3840 x 2160,Smart TV,14.3,Đã mua 3 TV trên Tiki  tất cả đều ổn  nhìn chung là yên tâm với tốc độ giao hàng và chế độ hậu mãi của Tiki Chiếc này giao trong vòng 20p  nhanh vkl
55,Smart Tivi LG 4K 55 inch 55UM7300PTA,10990000 ,203,LG,55,UHD 4K 3840 x 2160,Smart TV,14.3,Cân nhắc mn mua hàng trên này nhé nhân viên đóng hàng kiểu gì mà không có cả chân đỡ  nhắn tin cho cskh bảo phục vụ từ 7h đến 20h mà mấy ngày không thèm trả lời
55,Smart Tivi LG 4K 55 inch 55UM7300PTA,10990000 ,203,LG,55,UHD 4K 3840 x 2160,Smart TV,14.3,Chất lượng hình ảnh tốt Âm thanh tạm ổn Bắt đc truyền hình mặt đất nên khỏi khéo Cable Cho 4 vì giao hàng chậm hơn dự kiến 3 ngày
55,Smart Tivi LG 4K 55 inch 55UM7300PTA,10990000 ,203,LG,55,UHD 4K 3840 x 2160,Smart TV,14.3,Khi mua cũng lo giao hàng bảo hành  may mọi chuyện êm xuôitiki giao hàng nhanh chắc do mua của tiki tradingtivi đã dc kích bảo hành hy vọng xài bền còn dịch vụ tiki thì 5 sao
55,Smart Tivi LG 4K 55 inch 55UM7300PTA,10990000 ,203,LG,55,UHD 4K 3840 x 2160,Smart TV,14.3,Lần đầu mua hàng giá trị trên tiki Thất vọng Tivi mới nhận được có 4 ngày mà thời gian gian bật nguồn đã là 265 giờ tiki làm ăn chụp giật
55,Smart Tivi LG 4K 55 inch 55UM7300PTA,10990000 ,203,LG,55,UHD 4K 3840 x 2160,Smart TV,14.3,mua tặng ông bà dịp tết vừa rồi đầy đủ chức năng mới nhất của smart tivi về thiết kế thì trung bình  cạnh dầy  cái này thì ok vì giá như vậy ko thể đòi hỏi thêm
55,Smart Tivi LG 4K 55 inch 55UM7300PTA,10990000 ,203,LG,55,UHD 4K 3840 x 2160,Smart TV,14.3,Chất lượng sp tốt  nhận hàng trước hạn giao Hơi bất tiện là nhân viên giao hàng ko cho mở ra ngay để ktra hàng và ko có người đến lắp đặt ngay  phải chờ sang hôm sau
55,Smart Tivi LG 4K 55 inch 55UM7300PTA,10990000 ,203,LG,55,UHD 4K 3840 x 2160,Smart TV,14.3,Hàng rất ok gia đình tôi rất hài lòng về sản phẩm này  giao hàng lắp đặt cũng rất nhanh  khi nào mua đồ điện tử chắc chắn sẽ tiếp tục mua của Mỏ Vàng
55,Smart Tivi LG 4K 55 inch 55UM7300PTA,10990000 ,203,LG,55,UHD 4K 3840 x 2160,Smart TV,14.3,tivi đẹp  âm thanh vòm nghe rất thích  như loa thùng hôm mua thấy có khuyến mãi xem netphim 1 năm mà không biết kích hoạt thế nào xin nhờ add tư vấn
55,Smart Tivi LG 4K 55 inch 55UM7300PTA,10990000 ,203,LG,55,UHD 4K 3840 x 2160,Smart TV,14.3,Tôi mua sản phẩm được hơn 15 ngày mà vẫn chưa thấy hãng gửi tin nhắn kích hoạt được thông tin bảo hành Tôi yêu cầu Tiki xác minh lại vấn đề bảo hành
55,Smart Tivi LG 4K 55 inch 55UM7300PTA,10990000 ,203,LG,55,UHD 4K 3840 x 2160,Smart TV,14.3,Mình đã mua máy giặt  máy lạnh và giờ mua TV của Gia Khang  hàng tốt  shop uy tín  bảo hành điện tử nên ko lo  nhân viên giao lắp đặt hướng dẫn sử dụng nếu yêu cầu
55,Smart Tivi LG 4K 55 inch 55UM7300PTA,10990000 ,203,LG,55,UHD 4K 3840 x 2160,Smart TV,14.3,Giao hàng rất nhanh khu vực tỉnh mà 2 ngày đã nhận đc rồi nhân viên giao rất nhiệt tình nhờ Tiki kích hoạt bảo hành điện tử dùm mình
55,Smart Tivi LG 4K 55 inch 55UM7300PTA,10990000 ,203,LG,55,UHD 4K 3840 x 2160,Smart TV,14.3,Sản phẩm giao nhanh trước thời gian dự kiến Hàng chính hãng  vẫn còn nguyên niêm phong của nhà máy  magic remote của LG rất dễ sử dụng Giá Tiki bán rất hợp lý
55,Smart Tivi LG 4K 55 inch 55UM7300PTA,10990000 ,203,LG,55,UHD 4K 3840 x 2160,Smart TV,14.3,Hình ảnh đẹp  nhiều tính năng  giá quá tốt hàng chính hãng sẽ tự động kích hoạt bh sau khi tiki giao hàng 12 ngày
55,Smart Tivi LG 4K 55 inch 55UM7300PTA,10990000 ,203,LG,55,UHD 4K 3840 x 2160,Smart TV,14.3,Giao hàng khá nhanh đặt hàng từ nửa đêm hôm trước đến chiều hôm sau có ngay Sản khẩm đóng bọc khá kĩ giao hàng tốt Rất ưng
55,Smart Tivi LG 4K 55 inch 55UM7300PTA,10990000 ,203,LG,55,UHD 4K 3840 x 2160,Smart TV,14.3,tại sao mua tivi mới ở tiki mà đã kích hoạt bảo hành là sao nhận hàng là ngày 13102019 mà ti vi đã kích hoạt ngày 269 là saomong được phản hồi sớm nhất
55,Smart Tivi LG 4K 55 inch 55UM7300PTA,10990000 ,203,LG,55,UHD 4K 3840 x 2160,Smart TV,14.3,Giao hàng rồi và sau 48h k thấy nv ki thuật đến lắp ráp  Cho mình hỏi giơ muốn kich hoạt bảo hành thì cần gọi tiki theo số nào để kích hoạt
55,Smart Tivi LG 4K 55 inch 55UM7300PTA,10990000 ,203,LG,55,UHD 4K 3840 x 2160,Smart TV,14.3,Giao nhanh chóng  đóng gói cẩn thận Màn hình rõ nét  âm thanh hay và dễ sử dụng Hiện tại chưa có j ko hài lòng
55,Smart Tivi LG 4K 55 inch 55UM7300PTA,10990000 ,203,LG,55,UHD 4K 3840 x 2160,Smart TV,14.3,Hàng giao nhanh   có đồng kiểm   chất lượng tốt giá hợp lý   mua đồ điện tử của tiki rất nhuêuf lần   chưa lần nào thất vọng
55,Smart Tivi LG 4K 55 inch 55UM7300PTA,10990000 ,203,LG,55,UHD 4K 3840 x 2160,Smart TV,14.3,Sản phẩm như mong đợi  giá tốt  săn deal còn 8tr890 TikiNow miễn phí  đặt lúc 8h tối ngày 198 thì 10h30 sáng hôm sau đã giao đến nhà
55,Smart Tivi LG 4K 55 inch 55UM7300PTA,10990000 ,203,LG,55,UHD 4K 3840 x 2160,Smart TV,14.3,hàng giao kiểm tra ok   nhưng nhân viên giao chở nhiều hàng đè lên tivi tiki xem lại việc vận chuyển ko đúng kỹ thuật vận chuyển hàng hóa
55,Smart Tivi LG 4K 55 inch 55UM7300PTA,10990000 ,203,LG,55,UHD 4K 3840 x 2160,Smart TV,14.3,tv dùng tốt  cái này mua là cái thứ 2 cách cái trước gần 1 năm giao hàng không  đúng hẹn tuy nhiên thông cảm do ngày 1111
55,Smart Tivi LG 4K 55 inch 55UM7300PTA,10990000 ,203,LG,55,UHD 4K 3840 x 2160,Smart TV,14.3,Sản phẩm mình thấy phù hợp Đang định cho 3 vì giao hàng quá lâu không được hỗ trợ Thấy anh giao hàng vất vả 10h đêm vẫn giao nên cho 4
55,Smart Tivi LG 4K 55 inch 55UM7300PTA,10990000 ,203,LG,55,UHD 4K 3840 x 2160,Smart TV,14.3,tivi to đẹp mới 100 bóc tem luôn hehe nhờ tiki kick hoạt bảo hành giùm luôn
55,Smart Tivi LG 4K 55 inch 55UM7300PTA,10990000 ,203,LG,55,UHD 4K 3840 x 2160,Smart TV,14.3,sp tốt giao hàng cực nhanh hơn 1 ngày nhân thêm niềm vui cho m cảm giác k phải chờ đợi lâu nhưng m chưa biết phải cài đặt bảo hành ntn
55,Smart Tivi LG 4K 55 inch 55UM7300PTA,10990000 ,203,LG,55,UHD 4K 3840 x 2160,Smart TV,14.3,Giao hàng đúng hẹnĐang trong thời gian dùng Tiki kích hoạt bảo hành nhanh Hơi tiếc vì vừa mua xong giá giảm một ít
55,Smart Tivi LG 4K 55 inch 55UM7300PTA,10990000 ,203,LG,55,UHD 4K 3840 x 2160,Smart TV,14.3,Tôi mua hàng của Điện máy City Sản phẩm chính hãng  nguyên tem Hình ảnh  âm thanh rõ nét Hệ điều hành WebOS dễ sử dụng  thân thiện
55,Smart Tivi LG 4K 55 inch 55UM7300PTA,10990000 ,203,LG,55,UHD 4K 3840 x 2160,Smart TV,14.3,xài khá thích mình đặt tiki now nhưng bị lỡ đt qua ngày hôm sau giao hàng bằng oto hẹn 48 giờ lắp đặt nhưng mình tự lắp đặt luôn
55,Smart Tivi LG 4K 55 inch 55UM7300PTA,10990000 ,203,LG,55,UHD 4K 3840 x 2160,Smart TV,14.3,TV 4K  xem youtube và MyTV rất nét và âm thanh hay  nhưng không hiểu sao mua mấy tuần rồi mà không kích hoạt bảo hành chính hãng cho mình nhỉ
55,Smart Tivi LG 4K 55 inch 55UM7300PTA,10990000 ,203,LG,55,UHD 4K 3840 x 2160,Smart TV,14.3,Mua tivi cho người thân  Mà tivi chất lượng quá  Cảm thấy mát lòng mát dạ Nhờ shop kích hoạt bảo hành điện tử cho mình
55,Smart Tivi LG 4K 55 inch 55UM7300PTA,10990000 ,203,LG,55,UHD 4K 3840 x 2160,Smart TV,14.3,Sản phẩm tốt Hình ảnh đẹp  Mới nguyên từ nhà sản xuất Sử dụng 1 thời gian xem thế nào 5 cho Tiki
55,Smart Tivi LG 4K 55 inch 55UM7300PTA,10990000 ,203,LG,55,UHD 4K 3840 x 2160,Smart TV,14.3,giao hàng nhanh  giá khuyến mãi ngon shop vui lòng kích hoạt bảo hành điện tử cho mình
55,Smart Tivi LG 4K 55 inch 55UM7300PTA,10990000 ,203,LG,55,UHD 4K 3840 x 2160,Smart TV,14.3,Sản phẩm sử dụng ổn định  đến nay chưa có vấn đề gì phát sinh Dịch vụ của Tiki chu đáo  chúng tôi hài lòng
55,Smart Tivi LG 4K 55 inch 55UM7300PTA,10990000 ,203,LG,55,UHD 4K 3840 x 2160,Smart TV,14.3,TV mới 100 lifetime từ 0hrs  hơi dầy  tuy nhiên giá tốt hơn so với các Tv 4k 55inch thương hiệu khác
55,Smart Tivi LG 4K 55 inch 55UM7300PTA,10990000 ,203,LG,55,UHD 4K 3840 x 2160,Smart TV,14.3,Tivi lg màn hình ips quá đẹp Giao hàng nhanh Cảm ơn các bạn Tiki cung cấp dịch vụ chất lượng  giá cả lại rẻ nữa
55,Smart Tivi LG 4K 55 inch 55UM7300PTA,10990000 ,203,LG,55,UHD 4K 3840 x 2160,Smart TV,14.3,San phâm ko co phân vân  nhưng chưa đươc kich hoat bao hanh
55,Smart Tivi LG 4K 55 inch 55UM7300PTA,10990000 ,203,LG,55,UHD 4K 3840 x 2160,Smart TV,14.3,Khá hài lòng giao hàng nhanh  nhưng nhân viên giao hàng thì càu nhàu quá  về việc vận chuyển tivi xa  cồng kềnh  haizzz
55,Smart Tivi LG 4K 55 inch 55UM7300PTA,10990000 ,203,LG,55,UHD 4K 3840 x 2160,Smart TV,14.3,Rất hài lòng chỉ có điều k vui là tiki k cho cắm điện test thử may là k có sự cố gì
55,Smart Tivi LG 4K 55 inch 55UM7300PTA,10990000 ,203,LG,55,UHD 4K 3840 x 2160,Smart TV,14.3,Giao hàng nhanh   khá hài lòng về sản phẩm  Vẫn chưa được kích hoạt bảo hành
55,Smart Tivi LG 4K 55 inch 55UM7300PTA,10990000 ,203,LG,55,UHD 4K 3840 x 2160,Smart TV,14.3,Tivi màu đẹp Âm thanh tốt 2 ngày sau kỹ thuật gọi hỏi lắp ráp nhg mình đã làm rồi
55,Smart Tivi LG 4K 55 inch 55UM7300PTA,10990000 ,203,LG,55,UHD 4K 3840 x 2160,Smart TV,14.3,Hình ảnh đẹp  magic remote tiện lợi  xứng đáng với số tiền bỏ ra
55,Smart Tivi LG 4K 55 inch 55UM7300PTA,10990000 ,203,LG,55,UHD 4K 3840 x 2160,Smart TV,14.3,Xài ok đó Coi film Châu Tinh Trì cực kì phê luôn các bác ạ
55,Smart Tivi LG 4K 55 inch 55UM7300PTA,10990000 ,203,LG,55,UHD 4K 3840 x 2160,Smart TV,14.3,Hài lòng về sản phẩm Đóng gói cẩn thận Hôm sau có nhân viên kỹ thuật đến lắp ráp
55,Smart Tivi LG 4K 55 inch 55UM7300PTA,10990000 ,203,LG,55,UHD 4K 3840 x 2160,Smart TV,14.3,Hàng chính hãng  chất lượng Giao nhanh Hỗ trợ lắp đặt nhanh chóng  nhiệt tình
55,Smart Tivi LG 4K 55 inch 55UM7300PTA,10990000 ,203,LG,55,UHD 4K 3840 x 2160,Smart TV,14.3,Ti vi dep nhan viên lap rap nhiệt tình vui vẻ lâu dài thì chưa biết sao nhug hag chinh hag sẽ ủng hộ shop
55,Smart Tivi LG 4K 55 inch 55UM7300PTA,10990000 ,203,LG,55,UHD 4K 3840 x 2160,Smart TV,14.3,Giao hành nhanh  nhân viên giao hàng nhiệt tình Làm ơn kích hoạt giúp mình bảo hành điện tử của LG
55,Smart Tivi LG 4K 55 inch 55UM7300PTA,10990000 ,203,LG,55,UHD 4K 3840 x 2160,Smart TV,14.3,Sản phẩm tốt  giao hàng hơi lâu  giá tốt Treo ở phòng khách rất đẹp
55,Smart Tivi LG 4K 55 inch 55UM7300PTA,10990000 ,203,LG,55,UHD 4K 3840 x 2160,Smart TV,14.3,giao hàng nhiệt tình  tivi to  treo phòng khách sang hẳn
55,Smart Tivi LG 4K 55 inch 55UM7300PTA,10990000 ,203,LG,55,UHD 4K 3840 x 2160,Smart TV,14.3,Tivi đẹp  sắc nét  giá ổn  hy vọng dùng bền theo năm tháng 
55,Smart Tivi LG 4K 55 inch 55UM7300PTA,10990000 ,203,LG,55,UHD 4K 3840 x 2160,Smart TV,14.3,Nhận hàng 1 ngày sau khi đặt  các bạn nv tổng đài hỗ trợ nhiệt tình
55,Smart Tivi LG 4K 55 inch 55UM7300PTA,10990000 ,203,LG,55,UHD 4K 3840 x 2160,Smart TV,14.3,Hàng mới  chính hãng  giao hàng nhanh  remote điều khiển dễ dàng nhanh chóng
55,Smart Tivi LG 4K 55 inch 55UM7300PTA,10990000 ,203,LG,55,UHD 4K 3840 x 2160,Smart TV,14.3,Đã nhận hàng đk 2 ngày  trước mắt dùng ổn  mong tiki sớm kích hoạt bảo hành cho mình
55,Smart Tivi LG 4K 55 inch 55UM7300PTA,10990000 ,203,LG,55,UHD 4K 3840 x 2160,Smart TV,14.3,Tiki giao hàng rất nhanh  sản phẩm chính hãng  nâng cao chất lượng sống của gia đình
55,Smart Tivi LG 4K 55 inch 55UM7300PTA,10990000 ,203,LG,55,UHD 4K 3840 x 2160,Smart TV,14.3,Sp ok Tốt Giao nhah Đặt hôm trc hôm sau có giao rồi Tiki làm ăn uy tín Sẽ ủng hộ típ
55,Smart Tivi LG 4K 55 inch 55UM7300PTA,10990000 ,203,LG,55,UHD 4K 3840 x 2160,Smart TV,14.3,hàng chuẩn  giao hàng đúng hạn Shop Điện máy City kích hoạt bảo hành giúp mình nhé
55,Smart Tivi LG 4K 55 inch 55UM7300PTA,10990000 ,203,LG,55,UHD 4K 3840 x 2160,Smart TV,14.3,Tiếng ấm  hình ảnh đẹp  remote tiện lợi đáng tiền lắm
55,Smart Tivi LG 4K 55 inch 55UM7300PTA,10990000 ,203,LG,55,UHD 4K 3840 x 2160,Smart TV,14.3,tiki giao hàng rất nhanh tivi xài ok  màn hình đẹp  giá cả rẻ hơn so với bên ngoài
55,Smart Tivi LG 4K 55 inch 55UM7300PTA,10990000 ,203,LG,55,UHD 4K 3840 x 2160,Smart TV,14.3,San pham tot  giao hang khong dung hen  hen thu 3 nhung thu 4 moi giao hang
55,Smart Tivi LG 4K 55 inch 55UM7300PTA,10990000 ,203,LG,55,UHD 4K 3840 x 2160,Smart TV,14.3,tivi tuyêt nhơ tiki kich hoat bao hanh giup minh nha
55,Smart Tivi LG 4K 55 inch 55UM7300PTA,10990000 ,203,LG,55,UHD 4K 3840 x 2160,Smart TV,14.3,Đã mua sản phẩm Hiện tốt Duy chỉ ko có jac 35 để cắm loa Tiki giao hàng đảm bảo
55,Smart Tivi LG 4K 55 inch 55UM7300PTA,10990000 ,203,LG,55,UHD 4K 3840 x 2160,Smart TV,14.3,Tính năng ok  kèm khiển điều khiển88 idjdbbdjid jdjd
55,Smart Tivi LG 4K 55 inch 55UM7300PTA,10990000 ,203,LG,55,UHD 4K 3840 x 2160,Smart TV,14.3,hàng giao nhanh chất lượng tốt mổi tội tivi hơi dàymong shop kích hoạt bh dùm mình
55,Smart Tivi LG 4K 55 inch 55UM7300PTA,10990000 ,203,LG,55,UHD 4K 3840 x 2160,Smart TV,14.3,sản phẩm chính hãng  mua xong nhận bảo hành điện tử sau 2 ngày  cám ơn tiki 
55,Smart Tivi LG 4K 55 inch 55UM7300PTA,10990000 ,203,LG,55,UHD 4K 3840 x 2160,Smart TV,14.3,giao hàng trong vong 2h Mê quá lắp xài luôn   hình ảnh sắc nét 
55,Smart Tivi LG 4K 55 inch 55UM7300PTA,10990000 ,203,LG,55,UHD 4K 3840 x 2160,Smart TV,14.3,Sản phẩm ok nhưng mãi mới kích hoạt bảo hành điện tử cho khách
55,Smart Tivi LG 4K 55 inch 55UM7300PTA,10990000 ,203,LG,55,UHD 4K 3840 x 2160,Smart TV,14.3,Hài lòng với sản phẩm   giao hàng nhanh hơn dự kiến good
